{
  "schema": "commerce-order/v1",
  "provider": "woocommerce",
  "external_store_id": "3f1c2d4e-8b7a-4c61-9d2e-5a6b7c8d9e01",
  "external_order_id": "1044",
  "external_order_number": "1044",
  "order_status": "cancelled",
  "payment_status": "refunded",
  "currency": "DKK",
  "created_at": "2026-09-29T11:20:00Z",
  "updated_at": "2026-10-01T14:05:33Z",
  "paid_at": "2026-09-29T11:20:51Z",
  "customer": {
    "external_customer_id": "57",
    "email": "kunde@example.com"
  },
  "amounts": {
    "items_subtotal_ex_tax": 27760,
    "items_discount_ex_tax": 2776,
    "items_total_ex_tax": 24984,
    "items_tax": 6246,
    "shipping_ex_tax": 3120,
    "shipping_tax": 780,
    "fees_incl_tax": 0,
    "order_total_incl_tax": 35130
  },
  "line_items": [
    {
      "external_line_id": "320",
      "external_product_id": "88",
      "external_variant_id": "91",
      "sku": "KAFFE-1KG",
      "name": "Kaffebønner 1 kg",
      "quantity": 2,
      "subtotal_ex_tax": 23840,
      "discount_ex_tax": 2384,
      "total_ex_tax": 21456,
      "total_tax": 5364
    },
    {
      "external_line_id": "321",
      "external_product_id": "102",
      "external_variant_id": null,
      "sku": null,
      "name": "Kaffefiltre",
      "quantity": 1,
      "subtotal_ex_tax": 3920,
      "discount_ex_tax": 392,
      "total_ex_tax": 3528,
      "total_tax": 882
    }
  ],
  "refunds": [
    {
      "external_refund_id": "1060",
      "created_at": "2026-09-30T09:00:00Z",
      "total_incl_tax": 4410,
      "line_items": [
        {
          "external_line_id": "321",
          "quantity": 1,
          "total_ex_tax": 3528,
          "total_tax": 882
        }
      ],
      "shipping_ex_tax": 0,
      "shipping_tax": 0,
      "fees_incl_tax": 0
    },
    {
      "external_refund_id": "1071",
      "created_at": "2026-10-01T14:05:30Z",
      "total_incl_tax": 30720,
      "line_items": [
        {
          "external_line_id": "320",
          "quantity": 2,
          "total_ex_tax": 21456,
          "total_tax": 5364
        }
      ],
      "shipping_ex_tax": 3120,
      "shipping_tax": 780,
      "fees_incl_tax": 0
    }
  ],
  "provider_metadata": {
    "wc_status": "refunded",
    "prices_include_tax": true
  }
}
