{
  "schema": "commerce-order/v1",
  "provider": "woocommerce",
  "external_store_id": "3f1c2d4e-8b7a-4c61-9d2e-5a6b7c8d9e01",
  "external_order_id": "1045",
  "external_order_number": "1045",
  "order_status": "completed",
  "payment_status": "paid",
  "currency": "DKK",
  "created_at": "2026-09-29T15:00:00Z",
  "updated_at": "2026-10-02T08:00:00Z",
  "paid_at": "2026-09-29T15:01:10Z",
  "customer": {
    "external_customer_id": "57",
    "email": "kunde@example.com"
  },
  "amounts": {
    "items_subtotal_ex_tax": 40000,
    "items_discount_ex_tax": 4000,
    "items_total_ex_tax": 36000,
    "items_tax": 9000,
    "shipping_ex_tax": 0,
    "shipping_tax": 0,
    "fees_incl_tax": 0,
    "order_total_incl_tax": 45000
  },
  "line_items": [
    {
      "external_line_id": "340",
      "external_product_id": "140",
      "external_variant_id": null,
      "sku": "KVAERN-01",
      "name": "Kaffekværn",
      "quantity": 1,
      "subtotal_ex_tax": 40000,
      "discount_ex_tax": 4000,
      "total_ex_tax": 36000,
      "total_tax": 9000
    }
  ],
  "refunds": [],
  "provider_metadata": {
    "wc_status": "completed",
    "prices_include_tax": true
  }
}
