{
  "schema": "commerce-order/v1",
  "provider": "woocommerce",
  "external_store_id": "3f1c2d4e-8b7a-4c61-9d2e-5a6b7c8d9e01",
  "external_order_id": "1046",
  "external_order_number": "1046",
  "order_status": "open",
  "payment_status": "unpaid",
  "currency": "DKK",
  "created_at": "2026-09-29T13:40:00Z",
  "updated_at": "2026-09-29T13:40:02Z",
  "paid_at": null,
  "customer": {
    "external_customer_id": "57",
    "email": "kunde@example.com"
  },
  "amounts": {
    "items_subtotal_ex_tax": 27760,
    "items_discount_ex_tax": 2776,
    "items_total_ex_tax": 24984,
    "items_tax": 6246,
    "shipping_ex_tax": 3120,
    "shipping_tax": 780,
    "fees_incl_tax": 0,
    "order_total_incl_tax": 35130
  },
  "line_items": [
    {
      "external_line_id": "330",
      "external_product_id": "88",
      "external_variant_id": "91",
      "sku": "KAFFE-1KG",
      "name": "Kaffebønner 1 kg",
      "quantity": 2,
      "subtotal_ex_tax": 23840,
      "discount_ex_tax": 2384,
      "total_ex_tax": 21456,
      "total_tax": 5364
    },
    {
      "external_line_id": "331",
      "external_product_id": "102",
      "external_variant_id": null,
      "sku": null,
      "name": "Kaffefiltre",
      "quantity": 1,
      "subtotal_ex_tax": 3920,
      "discount_ex_tax": 392,
      "total_ex_tax": 3528,
      "total_tax": 882
    }
  ],
  "refunds": [],
  "provider_metadata": {
    "wc_status": "pending",
    "hpos": true,
    "prices_include_tax": true
  }
}
